,text,label,hashtags
1621,@user Judge is Legislating from the Bench SCOTUS Said Last week that District Courts Can not Give Opinions for the Whole of The U.S Like SancutaryCities this will be thrown OUT! Trump MAGA Detain and Deport,1,"SancutaryCities,Trump,MAGA,Immigration2018"
1622,"Immigrant Rights Advocates Protest Boughton, Cooperation With ICE",0,"Connecticut,WelcomeImmigrants"
1623,The Times Strains to Credit France’s WorldCup Victory to Immigration,0,WorldCup
1624,Build The Wall. Its cheaper than maintaining a lifestyle that nearly 30% of Americans are living on. These are not guests. The are a mass of illegal citizens of another country invading ours.,1,BuildThatWall
1625,"""The new art is directly across the entrance to Cabeza Prieta, the natl wildlife refuge near the US/Mexico border in a region with the highest migrant death rate due to the brutality of the desert crossing"" | @user",0,"US/Mexico,border,safepassage,waternotwalls"
1626,"To be clear: the people on the left are the future of the Democratic Party, the people on the right are the future of the Republican Party. As an immigrant i walked away from the people on the left and I joined with honor the people on the right",0,walkaway
1627,Get rid of @user VoteRed - BuildTheWall from the Pacific Ocean to the Gulf of Mexico - NoDACA NoAmnesty Deport all illeagles and their families -,1,"VoteRed,BuildTheWall,NoDACA,NoAmnesty,Deport,ProudAmerican,AmericaFirst,MAGA,KAG"
1628,Most ‘˜refugees’ actually come from ‘˜normal’ circumstances,0,"America,UnitedNations..."
1629,"We were ecstatic to welcome a refugee family to memphis Tuesday after being separated for so long. We had community members, vols, staff gathered at the airport to celebrate. As we near WorldRefugeeDay 6/20, we will be sharing ways to show memphiswelcomesrefugees. Stay tuned!",0,"refugee,memphis,WorldRefugeeDay,memphiswelcomesrefugees."
1630,I understand the NotAllMen impulse cuz I’m a white woman who didn’t vote for Trump. But the women of color who call out all WW are right.,0,NotAllMen
1631,@user Great speec Mr. President. I would suggest change to KEEP AMERICA GREAT after u BuildThatWall that u promised and to make Mexico pay for it. Please keep the promisesmade and,1,"BuildThatWall,promisesmade,DoWhatYouSaid."
1632,Your ass is red My belt is blue Bend over bitch I ain't through with you,1,PoetsDay
1633,"IHearYou After sharing 'me too', seeing all of the i hear you tweets when I was expecting more Not all men.... sincerely, Thank you",0,IHearYou
1634,UN refugee agency to sack dozens of Gaza employees...,1,Gaza
1635,Lot’s to learn for internaldisplacement research from â¦@m_clemâ© @user at â¦@CGDevâ© on policy options for turning migration challenges into economic opportunities. â¦@CazabatCâ© â¦@AvigailShaiâ©,0,"internaldisplacement,migration,TheRippleEffect"
1636,Iraqi Immigrant Who Shot Cop In The Head Was Never Deported Despite Crime Spree via @user @user @user @user @user,0,Sendthemback
1637,"Sexual harassment/sexual assult/rape are NOT & NEVER ok As a man, I stand with every single woman whos been through this ✊",0,"Respect,MeToo"
1638,Sen Booker posted the confidential information on his twitter account. There is no way I will vote Democrat again. Disregard for the laws when it suits them. And he wants to run for,1,"POTUS.2Amendment,BuildThatWall,DeportThemAll,CivilWar,DeclassifyItAll"
1639,And they still can’t believe @user won? ðŸ¤·ðŸ»‘â™‚ï¸ They’d better get used to such winning. RedWaveRising2018 Trump2020 BuildThatWall EndImmigration MAGA ðŸ‘ŒðŸ» ðŸ‡ºðŸ‡¸,1,"winning.,RedWaveRising2018,Trump2020,BuildThatWall,EndImmigration,MAGA"
1640,Crimes committed by ILLEGAL immigrants should be public information everywhere like in Texas. More illegal aliens were arrested for homicide in the past 7 years in a single state than deaths by mass shooting in the other 49 states combined!,1,"SendThemBack,BuildTheWall"
1641,I kinda want to see you again just so I can punch you in the kidney.,1,WomenSuck
1642,A monthly blog about men of action for men's rights. Use your RSS feed to receive it.,0,"Sunrise,padres,bitcoin"
1643,Opinion: Anchor centers are shipwrecks of EU migration policy,0,EU
1644,@user @user & @user Build The Wall!,1,"MAGA,BuildTheWall,NoDACA,NoAmnesty,DeportAllOfThem"
1645,SpainSocialdemocrat^^ Borrell‘žMerkel has saved the honor of Europe opening the borders“And wants Germany and Spain to take in migrants^^The Russian German girl killed by an illegal Tunisian surely thinks the same ðŸ¤®OrganizedCrimeEU12pentagram ðŸ’©,1,ðŸ¤®OrganizedCrimeEU12pentagram
1646,"The German Government Pays for 3 Week Vacation for Refugees to Go Home MuslimImmigration No the German government isn't paying, the German taxpayers are paying! The German government is robbing native Germans to finance the Islamization of Germany.",1,MuslimImmigration
1647,"Immigrants come here on family-based visas, without regard to their skills As a result, half of all immigrant households receive Welfare RaiseAct will stop this Trump MAGA RedNationRising Immigration via @user",0,"RaiseAct,Trump,MAGA,RedNationRising,Immigration"
1648,"Please RT if you like!! luxurycars luxury supercars cars Golfer Gets Hole-In-One, Wins a Porsche",0,"luxurycars,luxury,supercars,cars"
1649,@user A Pallet of Bricks arrived today just in time to be placed on our Memorial Wall tomorrow on our 911Memorial broadcast via We are also shipping out several bricks to Patriots that ordered 2 Help BuildThatWall Ord,1,"911Memorial,BuildThatWall"
1650,@user @user @user @user @user @user Looks like it could be Hussein's cousin handling the,1,"$$$.BuyFromInAndOut,InternetBillOfRights,DarkLeft,WalkAway,ReinstateRobynGritz,JimJordan4Speaker,2A,DefundPP,ChainDeportation,Bu"
1651,Astonishing moment dozens of illegal migrants land on packed Spanish beach via @user invasion of Europe continues,0,"illegal,migrants,Europe,24/7freeloaders,Africans,islam"
1652,@user @user @user @user this is the mindset of the people the left are aligning themselves with. BuildThatWall and tighten our immigration laws. @user,1,BuildThatWall
1653,"In some cases, conditions have become worse for local people than for refugees. Is there favouritism from aid groups? ucanews voiceforthevoiceless Rohingya conflict @user @user @user @user @user @user @user @user @user",0,"refugees.,ucanews,voiceforthevoiceless,Rohingya,conflict"
1654,@user I would give you some lovin back but I'm just here to point out where women fuck up. But thanks <3,1,WomenSuck
1655,"By their own admission , proof beyond doubt that ""Israeli's"" were recent Europeans immigrants and never indigenous to Palestine land. Palestinians are IndigenousPeoples of Palestine.Palestinian will keep standing for their Homeland .Support then like Gilad doing.",0,"""Israeli's"",Europeans,Palestine,Palestinians,IndigenousPeoples,Palestine.Palestinian"
1656,@user Aiding Illegals is against Federal Immigration laws a Felon up to 5 years in Prison! Help SendthemBack instead of Burdening the U.S Taxpayer ! U.S Is NOT Central America's dumping ground for their kids we have U.S Homeless kids we need to help f,1,"Immigration,SendthemBack"
1657,A 6-Year-Old Girl Was Sexually Abused in an Immigrant-Detention Center,0,Infowars
1658,"@user THIS IS FABULOUS! I HOPE THE ACLU IS HOIST BY IT'S OWN PETARD!IT'S IDIOTIC, STUPID, SELF DEFEATING TO SIMPLY STOP APPLYING THE LAW BECAUSE THERE IS A CHILD INVOLVED!NO OTHER US LAW WOULD DO THIS! INSANITY! NOAMNESTY @user @user",1,"NOAMNESTY,NOASYLU"
1659,"Sounds like @user & @user are still competing for most hysterical woman at the hearings. Pathetic WeThePeople dont pay you to clutch pearls, or perform one act plays. Get your sh!t together.",1,"Pathetic,WeThePeople,ConfirmJudgeKavanaugh,ConfirmKavanaughNOWWalkAway"
1660,WorldFoodDay Thank you for celebrating Sri Foodnaath day. Please take action against that woman for refusing rape…,0,WorldFoodDay
1661,Is the Judge On Crack? he Said said Govt needs to prove it considered the benefits of having illegal Aliens here and working! Illegal Immigration cost $135 B a year while Illegals pay $!8 B in taxes ! Illegals are No Benefit to the U. S,1,"Trump,MAGA"
1662,"DACA Dreamer on the run, allegedly wanted for murder @user @user EndDACA Threat is just too great!NoAmnesty DeportThemAll KeepAmericansSafeNowhere in US Constitution does it say to protect Illegal Aliens!",1,"EndDACA,great!NoAmnesty,DeportThemAll,KeepAmericansSafeNowhere"
1663,"Strict government visa restrictions drive up illegal immigration, study finds",0,HostileEnvironment
1664,"The pain of a woman being targeted as a purely pleasure object, goes beyond the physical, its a rape of the soul",0,MeToo
1665,Women want their companies to pay for birth control? Bullshit. Anal is free birth control.,1,YesAllMen
1666,"The result of industrial scale immigration has been quite unprecedented.Inflows of people into lower-paid work, has had a negative impact on the wages of the lowest paid, as the Bank of England confirmed in",0,"immigration,2015.brexit,Brexiteers,BrexitBetrayal,brexitshambles,bitcoin"
1667,Video: Spain opens refugee camp after becoming new destination for migrants,0,Spain
1668,"potus must buildthatwall my first ever msg on Twitter so I hope I'm doing this right. @user Donald Trump will not ever change or abandon us or USA that's why I will be voting for him AGAIN! Dems and worrying about votes will not change him, POTUS is THE MAN!",1,"potus,buildthatwall,USA"
1669,"It is no secret that Hungary has become one of the safest countries in the world. While Western Europe opened its borders and accelerated its Islamisation during the migrant crisis, Eastern Europe did the opposite.",1,"Hungary,Islamisation,migrant"
1670,Mexican Fugitive Wanted For Murder Found In South Carolina We need a wall to keep these scum out of our,1,"country!BuildTheWall,NoDACANoAmnesty,MAGAKAG,VoteRed,WalkAway"
1671,@user wants to bring in more of these people into Canada. He is indifferent to refugees and terrorists coming to his country under the same banner. He and his party will be the death of a,1,"Canada.,country.TorontoTorontoShooting,TorontoStrong"
1672,"@user Yes, things need to be done with calm controlled minds, so irreparable mistakes won't be made.",1,BuildThatWall
1673,"If you stand with rape survivors against rape, then stand up and practice what you preach.",0,womentakeovertwitter
1674,"""Welcome to America"" Illegal Immigration is A Crime Detain and Deport Illegal Alien FamiliesBelongTogether in THEIR COUNTRY NOT THE U.S",1,FamiliesBelongTogether
1675,500 detained fathers and sons to go on strike after being separated Great. Problem,0,"solved.Illegal,immigrants"
1676,@user Just deport all these illegal aliens and their kids back to their 3rd world nation.,1,"MAGA,BuildTheWall,NoDACA,NoAmnesty,DeportAllOfThem"
1677,"To feel at home in a place, you have to have some prospect of staying there. Wendell Berry",0,missionarylife
1678,"RT @user If you've spent the weekend riding strange dick, drink some green tea &; it doesn't even count.",0,HoeTips
1679,"Do it, please. Make illegals the defining issue of the mid-term election. Let the left defend illegals at the expense of citizens.",1,"illegals,DeportThemAll,ArrestTheEmployers,EndDACA"
1680,This is how I feel about all our haters right now,0,YesAllMen
1681,And I urge Mattis to reject the Dems,1,"demand.BuildThatWall,BuildTheWallNow,BuildTheWall"
1682,"'What if, instead of finding “illegal immigrants”, our policies are creating them?'@trillingual's @user on @user case & the HostileEnvironment - also quotes our @user book which you can read in full at",0,HostileEnvironment
1683,@user How come you didnt cry when @user put children in cages?! Or when George Bush put them in cages?! Or even when @user enacted the law?!,1,"BuildThatWall,IllegalImmigration,ICE,LiberalismIsAMentalDisorder,NoDacaAmnesty,SecureOurBord"
1684,Pablo wont Fair well in Alabama TRASH will be taken out!!,1,"Alabama,KAS,BuildTheDamnWall,NOWNODACA,NOIllegals,NOPediophiles,NOSexTraffickers"
1685,"pay if you take migrantsðŸ‘‰Brussels tells EUstates. Imagine implications of this indirect “trafficking”, avenues for massive fraud.EU expands definition of “refugee” to include migrants in “refugee-like” situations.Visegrad V4 @user @user",0,"situations.Visegrad,V4"
1686,GIVEAWAY!! We're 11 donations away from 150 total donors for our peer-to-peer fundraising campaign designed around worldrefugeeday Our 150th donor will receive a World Relief t-shirt. Join the campaign today and donate online at,0,worldrefugeeday
1687,Matteo Salvini is welcome in the Netherlands anti-immigrant,1,"Salvini,Netherlands,stanceclosetheborders,illegal,Immigrants"
1688,"@user @user @user Hispanics are the hardest hit by Illegal Immigration it impacts their wages, jobs and communites as well as African Americans",1,"WalkAway,WalkAwayFromDemocrats"
1689,WOW can't believe all these women riding the subway today? Shouldn't these bitches be making sandwiches LOL,1,ihatefemales..
1690,"“What’s happening today will be written down as history, and we don’t want it to be fake history.”",0,"syria,refugees"
1691,"Kurdish refugees who were staying in Stage 2, in Skala Sykamia refused to enter the transportation buses provided by Greek authorities - Upon rumors that they were going to be taken back to Moria. Apparently they have decided to walk to Mytilene, more than 55Km away.",0,Moria.
1692,"@user @user Excellent Now BuildtheWall, EndChainMigration EndCatchandRelease EndVisaLottery approve TaxCuts2 ConfirmJudgeKavanaugh and we will have a great Mid-term and Christmas",1,"BuildtheWall,,EndChainMigration,EndCatchandRelease,EndVisaLottery,TaxCuts2,ConfirmJudgeKavanaugh"
1693,Is Spain facing a new wave of xenophobia over migrants?,0,Spain
1694,Liberals lie to Taxpayers over border crisis!,0,"cdnpoli,canpoli,cpc,lpc,ndp,border,IllegalImmigrants,FordNation,ForThePeople"
1695,I'm not gonna text you 24-7. I have a life. If you liked me that much you would be with me and not texting me!,1,WomenSuck
1696,Of course I invited you over to 'Hang Out' ....stupid bitches,1,WomenSuck
1697,ATTENTION AbortionGenocide the SUCCESSFUL TOOL of the LEFT*Urge Congress 2 use PP tax$ to SUPPORT PREGNANT WOMEN & their Babes once BORN* Preserve & PROTECT Generations of AMERICANS BORN to AMERICANS*Suspend Immigration STOP Resettlement*DEPORT & REPATRIATE*OUR,0,"AbortionGenocide,Congress,PP,HOMELAND*WeR1"
1698,@user U.S Taxpayers pay $135 Billion a year on Illegal Immigration Detain and Deport ASAP No More Dollars for Illegals U.S has Homeless Ctitizens and Veterans Take Care of them First!,1,"Immigration,Veterans,Trump,MAGa,RedNationRising"
1699,@user What's it going to take? Build that wall. BuildThatWall Migrants from terrorist nation entering the US.,1,BuildThatWall
1700,"No bitch you don't look like a model, nor will you ever. So stop saying youre ugly so people will call you pretty!",1,AttentionWhores
1701,VIDEO: (Part three) BNP A frame trailer with patriotic sound system.,0,"BNP,immigration,Brexit,Patriots,islam"
1702,On May 31st World Relief is offering you a unique and exciting opportunity to make a difference for refugees. Can you guess what it is? Here's another hint. This new opportunity will help you advocate for refugees. //,0,WRLovesRefugees
1703,SHUT. IT.,1,"DOWN.BorderWall,BuildThatWall,KAG"
1704,"The earth, rutted deep from hundreds of wheels, churned raw by thousands of hooves, bore witness to the recent passing of a large immigrant party—all save one battered wagon that sat alone. ❈HANGTOWN CREEK❈ ACTION ADVENTURE FREE on",0,"ACTION,ADVENTURE,KindleUnlimited"
1705,Start a journey with Alain! Live inÂ 360ÂºÂ andÂ VRÂ how a refugee strug to get into the Spanish coast. Thanks to @user and The Dream VR.Watch the whole experience hereÂ ðŸ“±âž¡ï¸Â,0,"360ÂºÂ,VRÂ"
1706,@user The 16 year plan they still want to enforce!!!!!!,1,"WINNING,MAGA.,Q,BuildThatWall,ANTIOBAMA"
1707,CA - well now. Then your votes wont count if you allow illegal aliens to vote. THAT IS AN AMERICAN PRIVILEGE!!,1,BuildThatWall
1708,Sweden: Muslim migrant whose deportation was thwarted by “hero” student was actually sentenced for assault,1,SWRM
1709,Well Kat... that's what happens when you're a whore 🤷🏽‍♀️ BlackInkCrewCHI Phor & Ryan (after he f'd your bff) yeah u a hoe 😂,1,BlackInkCrewCHI
1710,Illegal Alien Charged With Molesting Child In North Carolina BuildTheWall NoDACA NoAmnesty How many Children have to have their lives destroyed?Is there an acceptable criteria you are willing to,1,"BuildTheWall,NoDACA,NoAmnesty,accept?ChildRapeDeathPenalty"
1711,"ðŸ‘‹Say hi to Manish. He is Director of @user newest country programme here in Bangladesh. Here he is showing us around the huge refugee camp at Cox’s Bazar. Over the course of just a few weeks last year, hundreds of thousands of Rohingya people fled here from Myanmar.",0,"refugee,Rohingya"
1712,Great meeting @user 2 days thinking about immigration research agenda going forward. many smart words and ideas including from @user from @user much to share @user @user @user @user,0,immigration
1713,I wonder why girls even follow me. All I do is call you out on the sick shut you do to us guys,1,WomenSuck
1714,"Time for Bangladesh to recognize plight of refugees will be protracted. ""Having over 700,000 Rohingya living in makeshift shelters without an evacuation plan in case of a typhoon is just asking for a catastrophe"" says @user",0,"Bangladesh,refugees,Rohingya,Myanmar,Burma,Rakhine"
1715,What a glorious cunt you have. Too bad youre a basic bitch. Always were always will be. Stay mad. Hoe. Imtalkingaboutadude 😂😂😂,1,Imtalkingaboutadude
1716,@user @user @user Mexico City 1 of the largest cities in the world & 1 of the filthiest cities in the world. The Freeloaders are destroying our cities 1 neighborhood at a time!,1,StopTheInvasion
1717,@user @user TRAVEL ADVISORYDominic Durden & Mollie Tibbetts & Kate Steinle were murdered by Illegal Aliens!We must BuildThatWallFollow @user & @user & RETWEET Help out & order bricks or donate today at Follow @user,1,"BuildThatWallFollow,RETWEET"
1718,Darla you trifling skank!,1,QueenSugar
1719,".Considering THIS , the filth on the streets of San Francisco, and an unsecured border, we're asking for a pandemic. This has to stop.We're a sovereign, Christian nation.No apologies.",1,"Sovereignty,BuildThatWall"
1720,"CBS Reporter captures an illegal border crossing in broad daylight and he was scared! So, Mr. Begnaud, do you now understand why we need a border wall? The issue is real, & the motivation to enter illegally is great. BuildThatWall via @user",1,BuildThatWall
1721,"The case for refugees as a resource, not a burden for hosts by @user @user @user WithRefugees @user @user @user @user @user",0,WithRefugees
1722,"Report: Immigrant Deportation, Separation Can Have ‘Lifelong Impacts’",0,ChicagoTonight
1723,@user @user @user so YesAllWomen is fine but YesAllMen should burn in hell? Looks like someone didn't get their way,0,"YesAllWomen,YesAllMen"
1724,Guys only have one heart so dont play with it.... But they have two balls so play with those,1,WomenSuck
1725,Almost 400 migrants crossing from Morocco to Spain rescued in Mediterranean,0,Spain
1726,EU supports 10-month protection programme in Tanzania refugee camps through @user @user and @user via @user Withrefugees @user @user,0,Withrefugees
1727,"PRESIDENT TRUMP: We have TWO options. We have Military, we have HomelandSecurity.BuildThatWall @user",1,"Military,,HomelandSecurity.BuildThatWall"
1728,Came to France as an Armenian immigrant. Resisted Nazi fascism. Survived. Fought for socialism and equality. Demanded justice for the ArmenianGenocide. Died a hero.,0,"France,Nazi,socialism,ArmenianGenocide."
1729,.BuildTheWall ! RT if you agree Todays Illegals are Tomorrows Democrats! No more IllegalImmigration !NODaca NOChainMigration SecretSociety TuesdayThoughts MorningJoe WednesdayWisdom @user @user @user,1,".BuildTheWall,IllegalImmigration,NOChainMigration,SecretSociety,TuesdayThoughts,MorningJoe,WednesdayWisdom"
1730,"If you dont support Trump, than you can just go back to Mexico. And if your not from Mexico, you should just go there",1,anyway!MAGABuildThatWallArbysTrump
1731,"TakeAKnee trump's a chump! @user is the real deal-helping so many on his journey through greatness! Even @user can't stand IQ45-stands to CLEAN UP while he's in prison. One hot, lucky Immigrant babe! OHi12 VoteBlue @user in the Columbus area. BlueWave baby!",0,"TakeAKnee,IQ45-stands,Immigrant,OHi12,VoteBlue,Columbus,BlueWave"
1732,"@user That's just one of them. I noted that one of the missing was ""25 years old and working in foreign trade"". That means he was involved in transporting illegal drugs to the U.S. BuildThatWall @user .",1,BuildThatWall
1733,"Free speech has no limitations what so ever, otherwise it's not free speech you crazy fucking bitch!",0,FreeSpeech
1734,He started this hashtag because there's a certain type of immigrant to Germany he doesn't like and wants to humiliate. We @user are in that group. RT if you think we should be able to stay and finish our Bahnhof renovation. Danke!,0,neogermans
1735,A ProPublica investigation found that police responded to at least '25 calls reporting sex offenses' at child shelters that primarily serve immigrants during an analysis of over 70 of the about 100 shelters that exist in the U.S.,0,FamiliesBelongTogether
1736,Hollywood glorifying being a slut mom. You never have to grow up,1,"MGTOW,FeminismIsCancer"
1737,"Aren't u one of the low life scum who defends people bringing fentanyl into this country from Mexico?Sorry, but I won't apologize for being MORE concerned abt the 70,000 ppl dying from drug overdoses than people sneaking into the country",1,"illegallyBuildTheWall,BuildThatWall"
1738,The Refugee Survival Trust's new bus pass scheme for pregnant asylum seekers and new mothers is a lifeline for those cannot afford to buy their own tickets! Please help out our fundraiser if you can,0,"â¤ï¸scotland,refugee,ThursdayThought,charity"
1739,Can we rewrite the 1951 Refugee Convention for the 21st century? | CBC Radio WithRefugees @user @user @user @user @user @user @user,0,WithRefugees
1740,How to Pronounce Bitch Chameleon ↺RT❤,0,"fake,fuss,denounce,accuse,porcupine,crab,whore,bitc"
1741,".@RepChrisStewart .@SenMikeLee .@senorrinhatch NoDACA EVER! DACA hurts Utah it hurts American Citizens and irreparably damages the real AmericanDreamers - My Children, American Children. @user has the power to EndDACA Use it! Don't be afraid of",1,"NoDACA,DACA,Utah,American,AmericanDreamers,EndDACA,IllegalAliens"
1742,"Open Borders prove not only to be wrong, but harmful to native citizens and even FATAL. Every day the globalists false utopia is proven wrong with news and statistics. When will the madness stop? We need to close the borders.",1,"closetheborders,stoptheinvasion"
1743,This Idiot Wants to DECLARE WAR ON THE U.S!! Americaans Lets go to Mexico Illegally Vote in their Elections and Live off their Welfare System If they ask for ID Called them Racists then Sue ! Trump MAGA SaturdayMorning Immigration via @user,1,"Trump,MAGA,SaturdayMorning,Immigration"
1744,Illegal Alien unlicensed Drunk Driver rams Ambulance kills 3 year old being rushed to hospital.,1,"EndDACA,NoAmnesty,EnforceUSLawsKeepAmericaSafeDeportThemAll"
1745,STAY THE HELL OUT OF THE WATER. ARABIANSEA Stupid cunts.,1,"ARABIANSEA,nuclearban,solarban,PSE,MondayMotivation,plasticfree,horses,UN,China,India,Iran,WaterBan,NO,NoDeal,NoDACA,immigrationfraud,Mexico"
1746,"Makassar refugees, 'locked down' for 2 days from today, want Indonesia's President Joko Widodo @user to know that they are not a threat & welcome him. Please let the children out to play & adults need to buy food for the duration of your visit. Please retweet & email to help.",0,"Makassar,Indonesia's"
1747,"channel4 â¦@Channel4Newsâ© â¦@Channel4â© Always pushing the illegal immigrants are great guys agenda , never mention the cost or consequences",0,channel4
1748,"Refugees are like you and me. They want many of the same things we all do, like safety for their families and a promising future for their kids.Learn more about refugees by downloading our free e-book ""8 Things You Should Know About Refugees."" âž",0,Refugees
1749,100 Bangladeshi Nationals Apprehended near Texas Border in 3 Weeks via @user,1,"NoAmnesty,DeportIllegals,BuildThatWall,TRUMP,MAGA,MASA"
1750,@user Just deport all these illegal aliens and their kids back to their 3rd world nations. American citizens taxpayers are tired of being robbed by the 3rd world nation paying for these illegal aliens and their kids!,1,"MAGA,BuildTheWall,NoDACA,NoAmne"
1751,Filth @user Nodaca Deporthemall going to go turn on the phone now that you have to babysit that stupid gang behavior and idiotic graffiti.,1,"Filth,Nodaca,Deporthemall,Berkeley,CAdeservesbetter"
1752,Russia allocates $10mn to UN agency for Palestine refugees...,0,Russia
1753,SanDiego SanctuaryState Immigrants UnDocumented ICECalifornia Democrats have chosen 1. Criminals over the safety of the people; and...,0,"SanDiego,SanctuaryState,Immigrants,UnDocumented,ICECalifornia,Democrats,safety"
1754,"@user asked for a study to be done, then didn't like the results.",0,wewelcomerefugees
1755,Tell us how big a Slut you are and we tell the world!,1,Slut
1756,@user @user BITCH U NEED TO SHUT UR FUCKIN HOLE.. ENOUGH IS ENOUGH.,1,persist
1757,Why WomenBoycottTwitter? because you act like Ms. Whore.,1,WomenBoycottTwitter?
